{
  "$schema": "../../../schema/ssdd.config.schema.json",
  "cli": "ssdd",
  "agents": ["claude"],
  "commandPrefix": "ssdd",
  "implement": { "runTests": true },
  "git": { "remote": "origin", "push": true, "tagPrefix": "ssdd-v" },
  "test": {
    "runners": [
      {
        "name": "unit",
        "globs": ["src/**/*.test.ts"],
        "tagStyle": "name",
        "command": "npx vitest run -t \"{filter}\" --reporter=junit --outputFile=.ssdd-out/unit.xml",
        "junit": ".ssdd-out/unit.xml"
      }
    ]
  }
}
